{"$schema":"https://json-schema.org/draft/2020-12/schema","$id":"https://telemetryiq.local/schemas/canonical-event/0.1.0","title":"TelemetryIQ canonical event envelope","type":"object","additionalProperties":false,"required":["schema_version","event_id","event_type","occurred_at","received_at","provider","tool","source_schema","source_version","actor_id","device_id","session_id","task_id","repository_id","privacy_level","attributes","provider_extensions"],"properties":{"schema_version":{"const":"0.1.0"},"event_id":{"type":"string","minLength":1},"event_type":{"type":"string","minLength":1},"occurred_at":{"type":"string","format":"date-time"},"received_at":{"type":"string","format":"date-time"},"provider":{"type":"string","minLength":1},"tool":{"type":"string","minLength":1},"source_schema":{"type":"string","minLength":1},"source_version":{"type":"string","minLength":1},"actor_id":{"type":"string","minLength":1},"device_id":{"type":"string","minLength":1},"session_id":{"type":"string","minLength":1},"task_id":{"type":["string","null"]},"repository_id":{"type":["string","null"]},"privacy_level":{"enum":["aggregate","operational","governed-content","forensic"]},"attributes":{"type":"object"},"provider_extensions":{"type":"object"}}}
