[
  {
    "schema_version": "0.1.0",
    "event_id": "codex:skill:dee7ed4b65935dbc3a0da3b05e105573842b0b87d589145e6b1df266472ff0e3",
    "event_type": "codex.skill.injected",
    "occurred_at": "2026-09-06T14:53:41.601372612Z",
    "received_at": "2026-09-06T14:53:41Z",
    "provider": "openai",
    "tool": "codex",
    "source_schema": "otel",
    "source_version": "0.153.4",
    "actor_id": "unavailable",
    "device_id": "unavailable",
    "session_id": "codex:skill:dee7ed4b65935dbc3a0da3b05e105573842b0b87d589145e6b1df266472ff0e3",
    "task_id": null,
    "repository_id": null,
    "privacy_level": "operational",
    "attributes": {
      "unavailable_fields": [
        "model",
        "token_usage",
        "cache_usage",
        "tool_calls",
        "file_operations",
        "command_execution",
        "approvals",
        "prompt_content",
        "response_content",
        "repository_context",
        "task_outcome",
        "provider_cost",
        "session_lifecycle"
      ]
    },
    "provider_extensions": {
      "correlation": {
        "dedup_key": "codex:skill:dee7ed4b65935dbc3a0da3b05e105573842b0b87d589145e6b1df266472ff0e3",
        "ordering_key": "01788706421601372612:codex:skill:dee7ed4b65935dbc3a0da3b05e105573842b0b87d589145e6b1df266472ff0e3",
        "task_boundary": {
          "confidence": "unknown",
          "reason": "Codex skill metrics have no reviewed task-boundary signal"
        }
      },
      "datapoint": {
        "asInt": 1,
        "attributes": [
          {
            "key": "app.version",
            "value": {
              "stringValue": "0.153.4"
            }
          },
          {
            "key": "invoke_type",
            "value": {
              "stringValue": "implicit"
            }
          },
          {
            "key": "originator",
            "value": {
              "stringValue": "codex_exec"
            }
          },
          {
            "key": "session_source",
            "value": {
              "stringValue": "exec"
            }
          },
          {
            "key": "skill",
            "value": {
              "stringValue": "tiq-probe"
            }
          },
          {
            "key": "status",
            "value": {
              "stringValue": "ok"
            }
          }
        ],
        "startTimeUnixNano": "1788706408772193927",
        "timeUnixNano": "1788706421601372612"
      },
      "environment": {
        "app_version": "0.153.4"
      },
      "metric": {
        "count": 1,
        "name": "codex.skill.injected"
      },
      "metric_attributes": {
        "app.version": "0.153.4",
        "invoke_type": "implicit",
        "originator": "codex_exec",
        "session_source": "exec",
        "skill": "tiq-probe",
        "status": "ok"
      },
      "metric_envelope": {
        "name": "codex.skill.injected",
        "sum": {
          "aggregationTemporality": 1,
          "isMonotonic": true
        }
      },
      "resource": {
        "env": "telemetryiq-synthetic",
        "service.name": "codex_exec",
        "service.version": "0.153.4"
      },
      "resource_metric": {
        "resource": {
          "attributes": [
            {
              "key": "service.name",
              "value": {
                "stringValue": "codex_exec"
              }
            },
            {
              "key": "service.version",
              "value": {
                "stringValue": "0.153.4"
              }
            },
            {
              "key": "env",
              "value": {
                "stringValue": "telemetryiq-synthetic"
              }
            }
          ]
        }
      },
      "scope": {
        "attributes": {},
        "name": "codex"
      },
      "scope_metric": {
        "scope": {
          "name": "codex"
        }
      },
      "skill": {
        "invoke_type": "implicit",
        "name": "tiq-probe",
        "outcome": "success"
      },
      "skill_detection": "explicit"
    }
  },
  {
    "schema_version": "0.1.0",
    "event_id": "codex:skill:f48200a61dbf2f1acce7b80e5bee55626a6ca0b64e259973a2d58859e8c7ba19",
    "event_type": "codex.skill.injected",
    "occurred_at": "2026-09-06T14:53:41.601372612Z",
    "received_at": "2026-09-06T14:53:41Z",
    "provider": "openai",
    "tool": "codex",
    "source_schema": "otel",
    "source_version": "0.153.4",
    "actor_id": "unavailable",
    "device_id": "unavailable",
    "session_id": "codex:skill:f48200a61dbf2f1acce7b80e5bee55626a6ca0b64e259973a2d58859e8c7ba19",
    "task_id": null,
    "repository_id": null,
    "privacy_level": "operational",
    "attributes": {
      "unavailable_fields": [
        "model",
        "token_usage",
        "cache_usage",
        "tool_calls",
        "file_operations",
        "command_execution",
        "approvals",
        "prompt_content",
        "response_content",
        "repository_context",
        "task_outcome",
        "provider_cost",
        "session_lifecycle"
      ]
    },
    "provider_extensions": {
      "correlation": {
        "dedup_key": "codex:skill:f48200a61dbf2f1acce7b80e5bee55626a6ca0b64e259973a2d58859e8c7ba19",
        "ordering_key": "01788706421601372612:codex:skill:f48200a61dbf2f1acce7b80e5bee55626a6ca0b64e259973a2d58859e8c7ba19",
        "task_boundary": {
          "confidence": "unknown",
          "reason": "Codex skill metrics have no reviewed task-boundary signal"
        }
      },
      "datapoint": {
        "asInt": 1,
        "attributes": [
          {
            "key": "app.version",
            "value": {
              "stringValue": "0.153.4"
            }
          },
          {
            "key": "invoke_type",
            "value": {
              "stringValue": "explicit"
            }
          },
          {
            "key": "originator",
            "value": {
              "stringValue": "codex_exec"
            }
          },
          {
            "key": "session_source",
            "value": {
              "stringValue": "exec"
            }
          },
          {
            "key": "skill",
            "value": {
              "stringValue": "tiq-probe"
            }
          },
          {
            "key": "status",
            "value": {
              "stringValue": "ok"
            }
          }
        ],
        "startTimeUnixNano": "1788706408772193927",
        "timeUnixNano": "1788706421601372612"
      },
      "environment": {
        "app_version": "0.153.4"
      },
      "metric": {
        "count": 1,
        "name": "codex.skill.injected"
      },
      "metric_attributes": {
        "app.version": "0.153.4",
        "invoke_type": "explicit",
        "originator": "codex_exec",
        "session_source": "exec",
        "skill": "tiq-probe",
        "status": "ok"
      },
      "metric_envelope": {
        "name": "codex.skill.injected",
        "sum": {
          "aggregationTemporality": 1,
          "isMonotonic": true
        }
      },
      "resource": {
        "env": "telemetryiq-synthetic",
        "service.name": "codex_exec",
        "service.version": "0.153.4"
      },
      "resource_metric": {
        "resource": {
          "attributes": [
            {
              "key": "service.name",
              "value": {
                "stringValue": "codex_exec"
              }
            },
            {
              "key": "service.version",
              "value": {
                "stringValue": "0.153.4"
              }
            },
            {
              "key": "env",
              "value": {
                "stringValue": "telemetryiq-synthetic"
              }
            }
          ]
        }
      },
      "scope": {
        "attributes": {},
        "name": "codex"
      },
      "scope_metric": {
        "scope": {
          "name": "codex"
        }
      },
      "skill": {
        "invoke_type": "explicit",
        "name": "tiq-probe",
        "outcome": "success"
      },
      "skill_detection": "explicit"
    }
  }
]
