[{"schema_version":"0.1.0","event_id":"codex:dddddddddddddddddddddddddddddddd:3333333333333333","event_type":"session_task.turn","occurred_at":"2026-09-26T10:00:00Z","received_at":"2026-09-26T10:00:00Z","provider":"openai","tool":"codex","source_schema":"otel","source_version":"0.155.1","actor_id":"unavailable","device_id":"unavailable","session_id":"codex:tiq-thread-218","task_id":null,"repository_id":null,"privacy_level":"operational","attributes":{"unavailable_fields":["model","token_usage","cache_usage","tool_calls","file_operations","command_execution","approvals","prompt_content","response_content","repository_context","task_outcome","provider_cost"]},"provider_extensions":{"correlation":{"dedup_key":"codex:dddddddddddddddddddddddddddddddd:3333333333333333","ordering_key":"01790416800000000000:codex:dddddddddddddddddddddddddddddddd:3333333333333333","parent_span_id":null,"provider_session_id":"tiq-thread-218","session_id_source":"thread.id","span_id":"3333333333333333","task_boundary":{"confidence":"unknown","reason":"Codex trace telemetry has no reviewed task-boundary signal"},"trace_id":"dddddddddddddddddddddddddddddddd"},"resource":{"resource":{"attributes":[{"key":"service.name","value":{"stringValue":"codex_exec"}},{"key":"service.version","value":{"stringValue":"0.155.1"}}]}},"resource_attributes":{"service.name":"codex_exec","service.version":"0.155.1"},"scope":{"scope":{"name":"codex_exec"}},"span":{"endTimeUnixNano":"1790416802000000000","status":{"code":0}},"span_attributes":{"thread.id":"tiq-thread-218","turn.id":"tiq-turn-218"}}}]
