[
  {
    "schema_version": "0.1.0",
    "event_id": "claude-code:token:8387de0ecdb7c0f95b5dc96aeef541aa238fc87e4e093d72038188982c880c51",
    "event_type": "claude_code.token.usage",
    "occurred_at": "2026-09-11T07:50:30.911Z",
    "received_at": "2026-09-16T08:50:31Z",
    "provider": "anthropic",
    "tool": "claude-code",
    "source_schema": "otel",
    "source_version": "2.1.268",
    "actor_id": "claude-code:synthetic-user",
    "device_id": "unavailable",
    "session_id": "claude-code:00000000-0000-4000-8000-000000000001",
    "task_id": null,
    "repository_id": null,
    "privacy_level": "operational",
    "attributes": {
      "input_token_count": 120,
      "model": "claude-sonnet-5",
      "unavailable_fields": [
        "tool_calls",
        "mcp_calls",
        "file_operations",
        "command_execution",
        "prompt_content",
        "response_content",
        "repository_context",
        "task_outcome",
        "trace_span_correlation"
      ]
    },
    "provider_extensions": {
      "correlation": {
        "dedup_key": "claude-code:token:8387de0ecdb7c0f95b5dc96aeef541aa238fc87e4e093d72038188982c880c51",
        "ordering_key": "01789113030911000000:claude-code:token:8387de0ecdb7c0f95b5dc96aeef541aa238fc87e4e093d72038188982c880c51",
        "task_boundary": {
          "confidence": "unknown",
          "reason": "Claude Code usage metrics have no reviewed task-boundary signal"
        }
      },
      "environment": {
        "host_arch": "amd64",
        "os_type": "linux",
        "os_version": "0.0.0-synthetic",
        "user_email": "synthetic@example.test",
        "user_id": "synthetic-user"
      },
      "metric": {
        "name": "claude_code.token.usage",
        "token_type": "input",
        "unit": "tokens"
      },
      "metric_attributes": {
        "agent.name": "general-purpose",
        "effort": "high",
        "model": "claude-sonnet-5",
        "query_source": "main",
        "session.id": "00000000-0000-4000-8000-000000000001",
        "skill.name": "code-reviewer",
        "speed": "fast",
        "type": "input",
        "user.email": "synthetic@example.test",
        "user.id": "synthetic-user"
      },
      "resource": {
        "host.arch": "amd64",
        "os.type": "linux",
        "os.version": "0.0.0-synthetic",
        "service.name": "claude-code",
        "service.version": "2.1.268"
      }
    }
  },
  {
    "schema_version": "0.1.0",
    "event_id": "claude-code:token:a2956243a6ad9a15cc5c04a1a9fe5090868dcb77b186b971a30a71e29bebf137",
    "event_type": "claude_code.token.usage",
    "occurred_at": "2026-09-11T07:50:30.912Z",
    "received_at": "2026-09-16T08:50:31Z",
    "provider": "anthropic",
    "tool": "claude-code",
    "source_schema": "otel",
    "source_version": "2.1.268",
    "actor_id": "claude-code:synthetic-user",
    "device_id": "unavailable",
    "session_id": "claude-code:00000000-0000-4000-8000-000000000001",
    "task_id": null,
    "repository_id": null,
    "privacy_level": "operational",
    "attributes": {
      "model": "claude-sonnet-5",
      "output_token_count": 340,
      "unavailable_fields": [
        "tool_calls",
        "mcp_calls",
        "file_operations",
        "command_execution",
        "prompt_content",
        "response_content",
        "repository_context",
        "task_outcome",
        "trace_span_correlation"
      ]
    },
    "provider_extensions": {
      "correlation": {
        "dedup_key": "claude-code:token:a2956243a6ad9a15cc5c04a1a9fe5090868dcb77b186b971a30a71e29bebf137",
        "ordering_key": "01789113030912000000:claude-code:token:a2956243a6ad9a15cc5c04a1a9fe5090868dcb77b186b971a30a71e29bebf137",
        "task_boundary": {
          "confidence": "unknown",
          "reason": "Claude Code usage metrics have no reviewed task-boundary signal"
        }
      },
      "environment": {
        "host_arch": "amd64",
        "os_type": "linux",
        "os_version": "0.0.0-synthetic",
        "user_id": "synthetic-user"
      },
      "metric": {
        "name": "claude_code.token.usage",
        "token_type": "output",
        "unit": "tokens"
      },
      "metric_attributes": {
        "marketplace.name": "acme-marketplace",
        "mcp_server.name": "github",
        "mcp_tool.name": "create_issue",
        "model": "claude-sonnet-5",
        "plugin.name": "review-suite",
        "query_source": "main",
        "session.id": "00000000-0000-4000-8000-000000000001",
        "type": "output",
        "user.id": "synthetic-user"
      },
      "resource": {
        "host.arch": "amd64",
        "os.type": "linux",
        "os.version": "0.0.0-synthetic",
        "service.name": "claude-code",
        "service.version": "2.1.268"
      }
    }
  },
  {
    "schema_version": "0.1.0",
    "event_id": "claude-code:cost:d1f120f0dcb232badd8197e5831c3af06152a72049e37655b66d39d1b1803734",
    "event_type": "claude_code.cost.usage",
    "occurred_at": "2026-09-11T07:50:30.913Z",
    "received_at": "2026-09-16T08:50:31Z",
    "provider": "anthropic",
    "tool": "claude-code",
    "source_schema": "otel",
    "source_version": "2.1.268",
    "actor_id": "claude-code:synthetic-user",
    "device_id": "unavailable",
    "session_id": "claude-code:00000000-0000-4000-8000-000000000001",
    "task_id": null,
    "repository_id": null,
    "privacy_level": "operational",
    "attributes": {
      "model": "claude-sonnet-5",
      "provider_cost": 0.0123,
      "unavailable_fields": [
        "token_usage",
        "tool_calls",
        "mcp_calls",
        "file_operations",
        "command_execution",
        "prompt_content",
        "response_content",
        "repository_context",
        "task_outcome",
        "trace_span_correlation"
      ]
    },
    "provider_extensions": {
      "correlation": {
        "dedup_key": "claude-code:cost:d1f120f0dcb232badd8197e5831c3af06152a72049e37655b66d39d1b1803734",
        "ordering_key": "01789113030913000000:claude-code:cost:d1f120f0dcb232badd8197e5831c3af06152a72049e37655b66d39d1b1803734",
        "task_boundary": {
          "confidence": "unknown",
          "reason": "Claude Code usage metrics have no reviewed task-boundary signal"
        }
      },
      "environment": {
        "host_arch": "amd64",
        "os_type": "linux",
        "os_version": "0.0.0-synthetic",
        "user_id": "synthetic-user"
      },
      "metric": {
        "name": "claude_code.cost.usage",
        "unit": "USD"
      },
      "metric_attributes": {
        "agent.name": "general-purpose",
        "model": "claude-sonnet-5",
        "query_source": "main",
        "session.id": "00000000-0000-4000-8000-000000000001",
        "skill.name": "code-reviewer",
        "user.id": "synthetic-user"
      },
      "resource": {
        "host.arch": "amd64",
        "os.type": "linux",
        "os.version": "0.0.0-synthetic",
        "service.name": "claude-code",
        "service.version": "2.1.268"
      }
    }
  },
  {
    "schema_version": "0.1.0",
    "event_id": "claude-code:cost:a3f85239fbbfa0d1952a89f1027926e87209cc096b98d8dcd6285825c19a6f06",
    "event_type": "claude_code.cost.usage",
    "occurred_at": "2026-09-11T07:50:30.914Z",
    "received_at": "2026-09-16T08:50:31Z",
    "provider": "anthropic",
    "tool": "claude-code",
    "source_schema": "otel",
    "source_version": "2.1.268",
    "actor_id": "claude-code:synthetic-user",
    "device_id": "unavailable",
    "session_id": "claude-code:00000000-0000-4000-8000-000000000001",
    "task_id": null,
    "repository_id": null,
    "privacy_level": "operational",
    "attributes": {
      "model": "claude-sonnet-5",
      "provider_cost": 0.0045,
      "unavailable_fields": [
        "token_usage",
        "tool_calls",
        "mcp_calls",
        "file_operations",
        "command_execution",
        "prompt_content",
        "response_content",
        "repository_context",
        "task_outcome",
        "trace_span_correlation"
      ]
    },
    "provider_extensions": {
      "correlation": {
        "dedup_key": "claude-code:cost:a3f85239fbbfa0d1952a89f1027926e87209cc096b98d8dcd6285825c19a6f06",
        "ordering_key": "01789113030914000000:claude-code:cost:a3f85239fbbfa0d1952a89f1027926e87209cc096b98d8dcd6285825c19a6f06",
        "task_boundary": {
          "confidence": "unknown",
          "reason": "Claude Code usage metrics have no reviewed task-boundary signal"
        }
      },
      "environment": {
        "host_arch": "amd64",
        "os_type": "linux",
        "os_version": "0.0.0-synthetic",
        "user_id": "synthetic-user"
      },
      "metric": {
        "name": "claude_code.cost.usage",
        "unit": "USD"
      },
      "metric_attributes": {
        "marketplace.name": "acme-marketplace",
        "mcp_server.name": "github",
        "mcp_tool.name": "create_issue",
        "model": "claude-sonnet-5",
        "plugin.name": "review-suite",
        "query_source": "main",
        "session.id": "00000000-0000-4000-8000-000000000001",
        "user.id": "synthetic-user"
      },
      "resource": {
        "host.arch": "amd64",
        "os.type": "linux",
        "os.version": "0.0.0-synthetic",
        "service.name": "claude-code",
        "service.version": "2.1.268"
      }
    }
  }
]
